<!ELEMENT genres_details (genre_detail*)>
<!ELEMENT genre_detail EMPTY>
<!ATTLIST genre_detail genre_id IDREF #REQUIRED>
<!ATTLIST genre_detail book_id IDREF #REQUIRED>